{"$schema":"https://json-schema.org/draft/2020-12/schema","title":"DevelopmentResponse version 1","$ref":"#/$defs/DevelopmentResponse","$defs":{"DevelopmentResponse":{"type":"object","properties":{"version":{"const":1},"request_digest":{"type":"string","pattern":"^[0-9a-f]{64}$","minLength":64,"maxLength":64},"candidates":{"type":"array","items":{"$ref":"#/$defs/GeneratedCandidate"},"maxItems":256},"hypotheses":{"type":"array","items":{"$ref":"#/$defs/ChoiceHypothesis"},"maxItems":256},"evolutions":{"type":"array","items":{"$ref":"#/$defs/EvolutionSuggestion"},"maxItems":256},"unsupported":{"type":"array","items":{"type":"string","maxLength":4096},"maxItems":256}},"required":["version","request_digest","candidates","hypotheses","evolutions","unsupported"],"additionalProperties":false},"EvolutionSuggestion":{"type":"object","properties":{"id":{"type":"string","minLength":1,"maxLength":128,"pattern":"^[a-z0-9_-]+$"},"candidate":{"type":"string","minLength":1,"maxLength":128,"pattern":"^[a-z0-9_-]+$"},"needs":{"type":"array","items":{"type":"string","minLength":1,"maxLength":128,"pattern":"^[a-z0-9_-]+$"},"maxItems":256},"proposed_retirement":{"type":"array","items":{"type":"string","minLength":1,"maxLength":128,"pattern":"^[a-z0-9_-]+$"},"maxItems":256},"preserved_obligations":{"type":"array","items":{"type":"string","pattern":"^[0-9a-f]{64}$","minLength":64,"maxLength":64},"maxItems":256},"mappings":{"type":"array","items":{"$ref":"#/$defs/SemanticMapping"},"maxItems":256},"scenarios":{"type":"array","items":{"$ref":"#/$defs/SuggestedScenarioMapping"},"maxItems":256}},"required":["id","candidate","needs","proposed_retirement","preserved_obligations","mappings","scenarios"],"additionalProperties":false},"SuggestedScenarioMapping":{"type":"object","properties":{"original":{"type":"string","pattern":"^[0-9a-f]{64}$","minLength":64,"maxLength":64},"replacement_json":{"type":"string","maxLength":1048576},"explanation":{"type":"string","maxLength":4096}},"required":["original","replacement_json","explanation"],"additionalProperties":false},"SemanticMapping":{"type":"object","properties":{"from":{"$ref":"#/$defs/SemanticKey"},"to":{"$ref":"#/$defs/SemanticKey"}},"required":["from","to"],"additionalProperties":false},"SemanticKey":{"type":"object","properties":{"kind":{"$ref":"#/$defs/SemanticKind"},"entity":{"anyOf":[{"type":"string","minLength":1,"maxLength":128,"pattern":"^[a-z0-9_-]+$"},{"type":"null"}]},"id":{"type":"string","minLength":1,"maxLength":128,"pattern":"^[a-z0-9_-]+$"}},"required":["kind","entity","id"],"additionalProperties":false},"SemanticKind":{"type":"string","enum":["entity","field","action","observable","output","view"]},"ChoiceHypothesis":{"type":"object","properties":{"id":{"type":"string","minLength":1,"maxLength":128,"pattern":"^[a-z0-9_-]+$"},"statement":{"type":"string","maxLength":4096},"kind":{"$ref":"#/$defs/HypothesisKind"},"action":{"type":"string","minLength":1,"maxLength":128,"pattern":"^[a-z0-9_-]+$"},"observable":{"type":"string","minLength":1,"maxLength":128,"pattern":"^[a-z0-9_-]+$"},"sources":{"type":"array","items":{"$ref":"#/$defs/SourceLocus"},"maxItems":256},"alternatives":{"type":"array","items":{"type":"string","minLength":1,"maxLength":128,"pattern":"^[a-z0-9_-]+$"},"maxItems":256},"related_decisions":{"type":"array","items":{"type":"string","minLength":1,"maxLength":128,"pattern":"^[a-z0-9_-]+$"},"maxItems":256},"scenario_json":{"type":"string","maxLength":1048576},"unknowns":{"type":"array","items":{"type":"string","maxLength":4096},"maxItems":256}},"required":["id","statement","kind","action","observable","sources","alternatives","related_decisions","scenario_json","unknowns"],"additionalProperties":false},"SourceLocus":{"type":"object","properties":{"relative_path":{"type":"string","maxLength":1024},"raw_digest":{"type":"string","pattern":"^[0-9a-f]{64}$","minLength":64,"maxLength":64},"pointer":{"type":"string","maxLength":4096}},"required":["relative_path","raw_digest","pointer"],"additionalProperties":false},"HypothesisKind":{"type":"string","enum":["unresolved_choice","possible_defect","requested_change"]},"GeneratedCandidate":{"type":"object","properties":{"id":{"type":"string","minLength":1,"maxLength":128,"pattern":"^[a-z0-9_-]+$"},"source_json":{"type":"string","maxLength":1048576}},"required":["id","source_json"],"additionalProperties":false}}}
