{"candidates":[{"id":"changed","source_json":"{\"actions\":[{\"ensures\":[],\"guards\":[],\"id\":\"add\",\"label\":\"Add work\",\"parameters\":{\"name\":{\"kind\":\"text\"},\"promised\":{\"kind\":\"date\"}},\"steps\":[{\"bind\":\"new\",\"entity\":\"job\",\"kind\":\"create\",\"values\":{\"done\":{\"kind\":\"literal\",\"value\":{\"kind\":\"boolean\",\"value\":false},\"value_type\":{\"kind\":\"boolean\"}},\"name\":{\"kind\":\"variable\",\"name\":\"name\"},\"production\":{\"kind\":\"literal\",\"value\":{\"kind\":\"integer\",\"value\":0},\"value_type\":{\"kind\":\"integer\"}},\"promised\":{\"kind\":\"variable\",\"name\":\"promised\"},\"started\":{\"kind\":\"today\"},\"wait_start\":{\"kind\":\"today\"},\"waited\":{\"kind\":\"literal\",\"value\":{\"kind\":\"integer\",\"value\":0},\"value_type\":{\"kind\":\"integer\"}},\"waiting\":{\"kind\":\"literal\",\"value\":{\"kind\":\"boolean\",\"value\":false},\"value_type\":{\"kind\":\"boolean\"}}}}]},{\"ensures\":[],\"guards\":[],\"id\":\"wait\",\"label\":\"Wait for materials\",\"parameters\":{\"row\":{\"entity\":\"job\",\"kind\":\"reference\"}},\"steps\":[{\"kind\":\"update\",\"record\":{\"kind\":\"variable\",\"name\":\"row\"},\"values\":{\"wait_start\":{\"kind\":\"today\"},\"waiting\":{\"kind\":\"literal\",\"value\":{\"kind\":\"boolean\",\"value\":true},\"value_type\":{\"kind\":\"boolean\"}}}}]},{\"ensures\":[],\"guards\":[],\"id\":\"resume\",\"label\":\"Resume production\",\"parameters\":{\"row\":{\"entity\":\"job\",\"kind\":\"reference\"}},\"steps\":[{\"kind\":\"update\",\"record\":{\"kind\":\"variable\",\"name\":\"row\"},\"values\":{\"waited\":{\"kind\":\"add\",\"left\":{\"field\":\"waited\",\"kind\":\"field\",\"record\":{\"kind\":\"variable\",\"name\":\"row\"}},\"right\":{\"earlier\":{\"field\":\"wait_start\",\"kind\":\"field\",\"record\":{\"kind\":\"variable\",\"name\":\"row\"}},\"kind\":\"date_difference\",\"later\":{\"kind\":\"today\"}}},\"waiting\":{\"kind\":\"literal\",\"value\":{\"kind\":\"boolean\",\"value\":false},\"value_type\":{\"kind\":\"boolean\"}}}}]},{\"ensures\":[],\"guards\":[],\"id\":\"calculate\",\"label\":\"Record production\",\"parameters\":{\"row\":{\"entity\":\"job\",\"kind\":\"reference\"}},\"steps\":[{\"kind\":\"update\",\"record\":{\"kind\":\"variable\",\"name\":\"row\"},\"values\":{\"production\":{\"kind\":\"add\",\"left\":{\"kind\":\"subtract\",\"left\":{\"earlier\":{\"field\":\"started\",\"kind\":\"field\",\"record\":{\"kind\":\"variable\",\"name\":\"row\"}},\"kind\":\"date_difference\",\"later\":{\"kind\":\"today\"}},\"right\":{\"kind\":\"add\",\"left\":{\"field\":\"waited\",\"kind\":\"field\",\"record\":{\"kind\":\"variable\",\"name\":\"row\"}},\"right\":{\"condition\":{\"field\":\"waiting\",\"kind\":\"field\",\"record\":{\"kind\":\"variable\",\"name\":\"row\"}},\"else_value\":{\"kind\":\"literal\",\"value\":{\"kind\":\"integer\",\"value\":0},\"value_type\":{\"kind\":\"integer\"}},\"kind\":\"if\",\"then_value\":{\"earlier\":{\"field\":\"wait_start\",\"kind\":\"field\",\"record\":{\"kind\":\"variable\",\"name\":\"row\"}},\"kind\":\"date_difference\",\"later\":{\"kind\":\"today\"}}}}},\"right\":{\"kind\":\"literal\",\"value\":{\"kind\":\"integer\",\"value\":1},\"value_type\":{\"kind\":\"integer\"}}}}}]},{\"ensures\":[],\"guards\":[],\"id\":\"complete\",\"label\":\"Complete work\",\"parameters\":{\"row\":{\"entity\":\"job\",\"kind\":\"reference\"}},\"steps\":[{\"kind\":\"update\",\"record\":{\"kind\":\"variable\",\"name\":\"row\"},\"values\":{\"done\":{\"kind\":\"literal\",\"value\":{\"kind\":\"boolean\",\"value\":true},\"value_type\":{\"kind\":\"boolean\"}}}}]},{\"ensures\":[],\"guards\":[],\"id\":\"archive\",\"label\":\"Archive work\",\"parameters\":{\"row\":{\"entity\":\"job\",\"kind\":\"reference\"}},\"steps\":[{\"kind\":\"archive\",\"record\":{\"kind\":\"variable\",\"name\":\"row\"}}]},{\"ensures\":[],\"guards\":[],\"id\":\"export\",\"label\":\"Export current and preserved results\",\"parameters\":{},\"steps\":[{\"binding\":\"row\",\"columns\":{\"name\":{\"field\":\"name\",\"kind\":\"field\",\"record\":{\"kind\":\"variable\",\"name\":\"row\"}},\"production\":{\"field\":\"production\",\"kind\":\"field\",\"record\":{\"kind\":\"variable\",\"name\":\"row\"}},\"promised\":{\"field\":\"promised\",\"kind\":\"field\",\"record\":{\"kind\":\"variable\",\"name\":\"row\"}},\"reminder\":{\"field\":\"waiting\",\"kind\":\"field\",\"record\":{\"kind\":\"variable\",\"name\":\"row\"}}},\"items\":{\"binding\":\"q\",\"entity\":\"job\",\"include_archived\":true,\"kind\":\"query\",\"limit\":1000,\"predicate\":{\"kind\":\"literal\",\"value\":{\"kind\":\"boolean\",\"value\":true},\"value_type\":{\"kind\":\"boolean\"}},\"sort\":[]},\"kind\":\"emit\",\"output\":\"sheet\"}]}],\"entities\":[{\"constraints\":[],\"fields\":[{\"id\":\"name\",\"label\":\"Name\",\"value_type\":{\"kind\":\"text\"}},{\"id\":\"started\",\"label\":\"Started\",\"value_type\":{\"kind\":\"date\"}},{\"id\":\"promised\",\"label\":\"Customer commitment\",\"value_type\":{\"kind\":\"date\"}},{\"id\":\"waiting\",\"label\":\"Waiting\",\"value_type\":{\"kind\":\"boolean\"}},{\"id\":\"wait_start\",\"label\":\"Wait began\",\"value_type\":{\"kind\":\"date\"}},{\"id\":\"waited\",\"label\":\"Completed waiting intervals\",\"value_type\":{\"kind\":\"integer\"}},{\"id\":\"done\",\"label\":\"Completed\",\"value_type\":{\"kind\":\"boolean\"}},{\"id\":\"production\",\"label\":\"Recorded production days\",\"value_type\":{\"kind\":\"integer\"}}],\"id\":\"job\",\"label\":\"Work\",\"unique\":[]}],\"id\":\"studio\",\"initial_view\":\"work\",\"label\":\"Fictional frame studio\",\"observables\":[{\"id\":\"waiting_jobs\",\"label\":\"Jobs waiting for materials\",\"value\":{\"items\":{\"binding\":\"q\",\"entity\":\"job\",\"include_archived\":false,\"kind\":\"query\",\"limit\":1000,\"predicate\":{\"field\":\"waiting\",\"kind\":\"field\",\"record\":{\"kind\":\"variable\",\"name\":\"q\"}},\"sort\":[]},\"kind\":\"count\"}}],\"outputs\":[{\"columns\":[{\"id\":\"name\",\"label\":\"Name\",\"value_type\":{\"kind\":\"text\"}},{\"id\":\"production\",\"label\":\"Production days\",\"value_type\":{\"kind\":\"integer\"}},{\"id\":\"promised\",\"label\":\"Customer commitment\",\"value_type\":{\"kind\":\"date\"}},{\"id\":\"reminder\",\"label\":\"Follow up materials\",\"value_type\":{\"kind\":\"boolean\"}}],\"format\":\"csv\",\"id\":\"sheet\",\"label\":\"Work results\"}],\"state\":[],\"version\":1,\"views\":[{\"actions\":[],\"id\":\"work\",\"keys\":[],\"kind\":{\"columns\":[{\"id\":\"name\",\"label\":\"Name\",\"value\":{\"field\":\"name\",\"kind\":\"field\",\"record\":{\"kind\":\"variable\",\"name\":\"row\"}}},{\"id\":\"production\",\"label\":\"Production days\",\"value\":{\"field\":\"production\",\"kind\":\"field\",\"record\":{\"kind\":\"variable\",\"name\":\"row\"}}},{\"id\":\"promised\",\"label\":\"Customer commitment\",\"value\":{\"field\":\"promised\",\"kind\":\"field\",\"record\":{\"kind\":\"variable\",\"name\":\"row\"}}},{\"id\":\"reminder\",\"label\":\"Follow up materials\",\"value\":{\"field\":\"waiting\",\"kind\":\"field\",\"record\":{\"kind\":\"variable\",\"name\":\"row\"}}}],\"controls\":[],\"entity\":\"job\",\"kind\":\"list\",\"rows\":{\"binding\":\"q\",\"entity\":\"job\",\"include_archived\":true,\"kind\":\"query\",\"limit\":1000,\"predicate\":{\"kind\":\"literal\",\"value\":{\"kind\":\"boolean\",\"value\":true},\"value_type\":{\"kind\":\"boolean\"}},\"sort\":[]},\"selection\":null},\"label\":\"Work\"}]}"}],"evolutions":[],"hypotheses":[],"request_digest":"3c125853cbc434be60fd1546547babfcc6052af53c3fd283c3f059fc3f2305a8","unsupported":[],"version":1}